{
  "$schema": "https://json-schema.org/draft/2020-12/schema",
  "$id": "https://github.com/Bjonat/enviro_veille/config/schemas/tendances.schema.json",
  "title": "Analyse de tendances environnementales",
  "type": "object",
  "required": ["period", "generated_at", "trends", "meta"],
  "properties": {
    "schema_version": {
      "type": "string",
      "const": "2.0",
      "description": "Présent sur les artefacts produits par l'orchestrateur v2. Les historiques sans ce champ restent lisibles."
    },
    "period": {
      "type": "object",
      "required": ["start", "end"],
      "properties": {
        "start": { "type": "string", "format": "date" },
        "end": { "type": "string", "format": "date" },
        "label": { "type": "string" }
      }
    },
    "generated_at": { "type": "string", "format": "date-time" },
    "meta": {
      "type": "object",
      "properties": {
        "daily_files_used": { "type": "integer" },
        "items_analyzed": { "type": "integer" },
        "method_notes": { "type": "string" }
      }
    },
    "trends": {
      "type": "array",
      "items": {
        "type": "object",
        "required": [
          "id",
          "title",
          "status",
          "themes",
          "evidence",
          "summary",
          "acceleration_score"
        ],
        "properties": {
          "id": { "type": "string" },
          "canonical_id": {
            "type": "string",
            "description": "Identifiant stable du sujet à conserver d'une période à l'autre."
          },
          "first_seen": {
            "type": "string",
            "description": "Première période où ce sujet a été identifié, selon la convention du repo."
          },
          "last_seen": {
            "type": "string",
            "description": "Période courante où le sujet est observé."
          },
          "previous_period_id": { "type": ["string", "null"] },
          "previous_status": {
            "enum": [null, "emergente", "en_acceleration", "stable", "en_deceleration", "structurelle"]
          },
          "previous_acceleration_score": {
            "type": ["integer", "null"],
            "minimum": 1,
            "maximum": 5
          },
          "score_delta": {
            "type": ["integer", "null"],
            "minimum": -4,
            "maximum": 4
          },
          "evolution_note": {
            "type": "string",
            "description": "Ce qui explique la continuité, l'accélération, la décélération ou la requalification depuis la période précédente."
          },
          "title": { "type": "string" },
          "status": {
            "type": "string",
            "enum": [
              "emergente",
              "en_acceleration",
              "stable",
              "en_deceleration",
              "structurelle"
            ]
          },
          "themes": {
            "type": "array",
            "items": { "type": "string" }
          },
          "acceleration_score": {
            "type": "integer",
            "minimum": 1,
            "maximum": 5
          },
          "summary": { "type": "string" },
          "drivers": {
            "type": "array",
            "items": { "type": "string" },
            "description": "Réglementation, financement, science, pratique, tech…"
          },
          "evidence": {
            "type": "array",
            "items": {
              "type": "object",
              "properties": {
                "daily_item_id": { "type": "string" },
                "date": { "type": "string", "format": "date" },
                "title": { "type": "string" },
                "url": { "type": "string" }
              }
            }
          },
          "what_is_changing": { "type": "string" },
          "who_is_affected": {
            "type": "array",
            "items": { "type": "string" }
          },
          "time_horizon": {
            "type": "string",
            "enum": ["0-6_mois", "6-18_mois", "18_mois_plus"]
          }
        }
      }
    }
  }
}
