{
  "schema_version": "2.0",
  "period": {"start": "2026-08-18", "end": "2026-09-14", "label": "2026-W38"},
  "generated_at": "2026-09-15T03:53:34Z",
  "meta": {
    "daily_files_used": 24,
    "items_analyzed": 206,
    "method_notes": "Premier run orchestrateur v2. Fenêtre glissante de 28 jours (18/08–14/09), priorité aux signaux apparus après W37 (06/09). Comparaison longitudinale explicite ; les répétitions sans évolution ne font pas monter les scores."
  },
  "trends": [
    {
      "id": "2026-W38-extremes-adaptation-budgets",
      "canonical_id": "climat-extremes-reconstruction-adaptation",
      "first_seen": "2026-W35", "last_seen": "2026-W38",
      "previous_period_id": "2026-W37-extremes-macro-reconstruction",
      "previous_status": "en_acceleration", "previous_acceleration_score": 5, "score_delta": 0,
      "evolution_note": "Après le chiffrage macro et la reconstruction W37, W38 ajoute un record officiel de besoin de refroidissement et des contraintes budgétaires sur les investissements climatiques locaux. Niveau déjà maximal.",
      "title": "Extrêmes climatiques : l'adaptation devient structurelle mais l'ingénierie financière se tend",
      "status": "structurelle",
      "themes": ["climat_adaptation", "incendies_risques", "reglementation", "donnees_outils"],
      "acceleration_score": 5,
      "summary": "Le record de besoins de refroidissement consolide l'adaptation comme sujet d'investissement permanent, tandis que collectivités et programmes publics arbitrent plus durement leurs budgets.",
      "drivers": ["climat", "financement", "données", "pratique territoriale"],
      "evidence": [
        {"daily_item_id": "2026-09-09-004", "date": "2026-09-08", "title": "Adaptation scolaire à la canicule : le budget diagnostics Actee réduit de 56 à 16 millions d'euros", "url": "https://www.actu-environnement.com/dit-aujourdhui/1829.html"},
        {"daily_item_id": "2026-09-11-003", "date": "2026-09-10", "title": "Budget 2027 : France urbaine alerte sur la capacité d'investissement climatique des métropoles", "url": "https://franceurbaine.org/actualites/budget-2027-france-urbaine-demande-une-mobilisation-de-moyens-en-coherence-avec-les-objectifs-climatiques-nationaux/"},
        {"daily_item_id": "2026-09-14-001", "date": "2026-09-11", "title": "SDES : été 2026 record de besoins de refroidissement", "url": "https://www.statistiques.developpement-durable.gouv.fr/des-temperatures-exceptionnelles-tout-au-long-de-lete-2026-un-besoin-de-refroidissement-le-plus"}
      ],
      "what_is_changing": "L'adaptation devient un arbitrage d'investissement : il faut hiérarchiser vulnérabilités, actifs et travaux sous contrainte budgétaire.",
      "who_is_affected": ["collectivités et EPCI", "gestionnaires de bâtiments publics", "services climat", "bureaux d'études adaptation"],
      "time_horizon": "0-6_mois"
    },
    {
      "id": "2026-W38-eau-stress-investissements",
      "canonical_id": "eau-stress-gouvernance-diagnostics",
      "first_seen": "2026-W35", "last_seen": "2026-W38",
      "previous_period_id": "2026-W37-eau-assecs-zones-humides",
      "previous_status": "en_acceleration", "previous_acceleration_score": 5, "score_delta": 0,
      "evolution_note": "La tension hydrique se confirme avec les nappes sous les normales et un CASH national ; l'enjeu se déplace vers suivi, réutilisation et investissements. Score maintenu à 5.",
      "title": "Eau : stress hydrique durable, nouveaux suivis azote et préparation d'investissements d'adaptation",
      "status": "structurelle",
      "themes": ["eau_zones_humides", "climat_adaptation", "reglementation", "sols"],
      "acceleration_score": 5,
      "summary": "Les nappes restent sous tension, le cadre zones humides évolue et l'expérimentation bretonne fondée sur les reliquats devient opérationnelle.",
      "drivers": ["crise climatique", "réglementation", "données hydrologiques", "pratique agricole"],
      "evidence": [
        {"daily_item_id": "2026-09-02-003", "date": "2026-09-01", "title": "Loi d'urgence agricole 2026-796 : assouplissement des prescriptions sur les zones humides", "url": "https://www.actu-environnement.com/ae/reglementation/loi-du-18-08-2026-2026-796-40198.php"},
        {"daily_item_id": "2026-09-11-002", "date": "2026-09-09", "title": "Hydrologie : CASH à Orléans et nappes toujours sous tension fin août", "url": "https://www.brgm.fr/fr/actualite/communique-presse/nappes-eau-souterraine-au-1er-septembre-2026"},
        {"daily_item_id": "2026-09-12-005", "date": "2026-09-10", "title": "CASH du 9 septembre : situation hydrologique sous tension", "url": "https://www.actu-environnement.com/ae/news/comite-anticipation-suivi-hydrologique-monique-barbut-mission-acceleration-adaptation-48496.php4"}
      ],
      "what_is_changing": "Le besoin glisse de la gestion de crise vers des diagnostics quantifiés et la programmation de mesures d'adaptation.",
      "who_is_affected": ["syndicats d'eau", "agences de l'eau", "DREAL/DDT(M)", "exploitants agricoles", "bureaux d'études eau-écologie"],
      "time_horizon": "0-6_mois"
    },
    {
      "id": "2026-W38-restauration-nature-operationnelle",
      "canonical_id": "restauration-nature-habitats-especes",
      "first_seen": "2026-W36", "last_seen": "2026-W38",
      "previous_period_id": "2026-W37-restauration-nrp-diagnostic",
      "previous_status": "en_acceleration", "previous_acceleration_score": 5, "score_delta": 0,
      "evolution_note": "Le calendrier national demeure en retard, mais des protections d'espèces et démonstrateurs de restauration rendent la dynamique plus concrète. Niveau déjà maximal.",
      "title": "Restauration de la nature : du plan national aux mesures espèces et démonstrateurs opérationnels",
      "status": "structurelle",
      "themes": ["biodiversite", "especes_habitats", "natura2000", "reglementation", "donnees_outils"],
      "acceleration_score": 5,
      "summary": "La restauration se matérialise par de nouvelles protections d'espèces, des fermetures de pêche reconduites et des retours d'expérience de restauration d'habitats marins.",
      "drivers": ["réglementation UE", "protection espèces", "science appliquée", "suivi écologique"],
      "evidence": [
        {"daily_item_id": "2026-09-05-004", "date": "2026-09-02", "title": "Plan national de restauration : la France annonce un envoi à Bruxelles d'ici quinze jours", "url": "https://environment.ec.europa.eu/news/eu-countries-submit-draft-plans-restoring-nature-2026-09-01_en"},
        {"daily_item_id": "2026-09-09-001", "date": "2026-09-08", "title": "Grand tétras et lagopède alpin : inscription définitive sur la liste des oiseaux protégés", "url": "https://www.actu-environnement.com/ae/reglementation/arrete-du-03-09-2026-tecl2619332a-40282.php"},
        {"daily_item_id": "2026-09-11-004", "date": "2026-09-09", "title": "Coraux d'eau froide : premiers résultats du programme Redecor", "url": "https://www.ifremer.fr/fr/presse/coraux-profonds-de-premiers-resultats-encourageants-pour-leur-restauration-dans-le-golfe-de"},
        {"daily_item_id": "2026-09-12-002", "date": "2026-09-11", "title": "Petits cétacés : fermetures de pêche reconduites pour 2027", "url": "https://www.actu-environnement.com/ae/reglementation/arrete-du-09-09-2026-tecm2623771a-40316.php"}
      ],
      "what_is_changing": "Inventaires, cartographies, objectifs de restauration et suivis de résultats deviennent des besoins durables sur plusieurs milieux.",
      "who_is_affected": ["OFB/DREAL", "gestionnaires Natura 2000", "collectivités", "gestionnaires d'espaces naturels", "BE biodiversité"],
      "time_horizon": "0-6_mois"
    },
    {
      "id": "2026-W38-electrification-enr-territoires",
      "canonical_id": "enr-reseaux-electrification-territoriale",
      "first_seen": "2026-W35", "last_seen": "2026-W38",
      "previous_period_id": "2026-W37-flexibilite-reseaux-enr",
      "previous_status": "en_acceleration", "previous_acceleration_score": 4, "score_delta": 1,
      "evolution_note": "W38 ajoute 109 territoires d'électrification, un décret opérationnel sur la solarisation des parkings et un nouveau référentiel CRE. Le sujet passe à un portefeuille de projets locaux.",
      "title": "Électrification et EnR : 109 territoires, solarisation des parkings et besoin d'ingénierie environnementale",
      "status": "en_acceleration",
      "themes": ["energie_biodiversite", "climat_adaptation", "reglementation", "donnees_outils"],
      "acceleration_score": 5,
      "summary": "La politique d'électrification se territorialise et multiplie les interfaces avec biodiversité, eau, paysage et études d'impact.",
      "drivers": ["planification territoriale", "réglementation", "investissement", "réseaux"],
      "evidence": [
        {"daily_item_id": "2026-09-10-001", "date": "2026-09-08", "title": "Solarisation des parkings : décret n° 2026-842", "url": "https://www.actu-environnement.com/ae/reglementation/decret-du-07-09-2026-2026-842-40284.php"},
        {"daily_item_id": "2026-09-11-001", "date": "2026-09-09", "title": "CRE : économie du système électrique et valeur assurantielle des ENR", "url": "https://www.cre.fr/actualites/toute-lactualite/la-cre-presente-son-rapport-sur-leconomie-du-systeme-electrique-francais-hexagonal.html"},
        {"daily_item_id": "2026-09-12-001", "date": "2026-09-11", "title": "Plan d'électrification : 109 territoires retenus", "url": "https://www.actu-environnement.com/ae/news/plan-electrification-territoires-retenus-communes-sortie-fossiles-gaz-48505.php4"}
      ],
      "what_is_changing": "Les maîtres d'ouvrage doivent articuler électrification, réseaux, stationnement, eau pluviale, biodiversité et autorisations.",
      "who_is_affected": ["collectivités et syndicats d'énergie", "développeurs EnR", "Enedis/RTE", "DREAL", "BE environnement"],
      "time_horizon": "0-6_mois"
    },
    {
      "id": "2026-W38-circularite-rep-ppwr",
      "canonical_id": "circularite-rep-ppwr",